{
  "$schema": "aicl-component-v1",
  "name": "Metadata List",
  "tag": "x-aicl-metadata-list",
  "category": "data",
  "status": "stable",
  "description": "Key-value definition list for displaying entity attributes.",
  "context": ["blade", "livewire", "filament-widget", "email", "pdf"],
  "not_for": ["filament-form", "filament-table"],
  "props": {
    "items": {
      "type": "array",
      "required": false,
      "default": [],
      "description": "Associative array of label => value pairs"
    }
  },
  "slots": {
    "default": {
      "description": "Optional custom content (alternative to items prop)"
    }
  },
  "variants": {},
  "composable_in": ["split-layout", "card-grid", "info-card"],
  "decision_rule": "Use in detail/view pages to display entity attributes as key-value pairs. Ideal for sidebar metadata in SplitLayout.",
  "field_signals": ["object", "key_value_pairs"],
  "filament_equivalent": {
    "context": "filament-infolist",
    "class": "Filament\\Infolists\\Infolist",
    "note": "In Filament infoolists, use TextEntry, IconEntry, etc."
  }
}
