{
  "$schema": "aicl-component-v1",
  "name": "Split Layout",
  "tag": "x-aicl-split-layout",
  "category": "layout",
  "status": "stable",
  "description": "Two-column layout with configurable ratio for main content and sidebar.",
  "context": ["blade", "livewire", "filament-widget"],
  "not_for": ["filament-form", "filament-table"],
  "props": {
    "ratio": {
      "type": "string",
      "required": false,
      "default": "2/3",
      "enum": ["1/2", "2/3", "3/4"],
      "description": "Column ratio between main and sidebar"
    },
    "reverse": {
      "type": "boolean",
      "required": false,
      "default": false,
      "description": "Swap main and sidebar positions"
    }
  },
  "slots": {
    "default": {
      "description": "Main content area"
    },
    "sidebar": {
      "description": "Sidebar content area"
    }
  },
  "variants": {},
  "composable_in": [],
  "decision_rule": "Use for main content area + contextual sidebar. Default 2/3 + 1/3 for detail views, 3/4 + 1/4 for content-heavy pages.",
  "field_signals": [],
  "filament_equivalent": {
    "context": "filament-form",
    "class": "Filament\\Schemas\\Components\\Grid",
    "note": "In Filament forms, use Grid with columns() for multi-column layouts"
  }
}
